### ISSUE TITLE
关于增加额外流量的问题

### ISSUE THREAD

**Issue by FangJianHust** [wangyu-/UDPspeeder#199]
请问下，我使用-f2:1来进行测试，理论上额外增加的流量是50%，但是我每次发送12字节的数据包，都要额外增加80~100左右的流量，也就是client和server之间的流量，具体见下面172.16.1.8.58746 > 172.16.1.8.4096的数据包：

```
11:57:46.024955 IP 42.120.75.136.52374 > 172.16.1.8.9006: UDP, length 12
11:57:46.033380 IP 172.16.1.8.58746 > 172.16.1.8.4096: UDP, length 47
11:57:46.033390 IP 172.16.1.8.58746 > 172.16.1.8.4096: UDP, length 39
11:57:46.035745 IP 42.120.75.136.52374 > 172.16.1.8.9006: UDP, length 12
11:57:46.036464 IP 127.0.0.1.45502 > 127.0.0.1.9007: UDP, length 12
11:57:46.043919 IP 172.16.1.8.58746 > 172.16.1.8.4096: UDP, length 40
11:57:46.043928 IP 172.16.1.8.58746 > 172.16.1.8.4096: UDP, length 52
11:57:46.044056 IP 127.0.0.1.45502 > 127.0.0.1.9007: UDP, length 12
11:57:46.045587 IP 42.120.75.136.52374 > 172.16.1.8.9006: UDP, length 12
```

求大神帮忙解释下，client的命令是：
`./speederv2_x86 -c -l0.0.0.0:9006  -r172.16.1.8:4096 -f2:1 -k "passwd" --random-drop 50`
